<?xml version="1.0" encoding="UTF-8"?>
<xs:schema xmlns:xs="http://www.w3.org/2001/XMLSchema">
    
    <xs:complexType name="avgJump">
        <xs:sequence>
            <xs:element name="athlete" maxOccurs="unbounded">
                <xs:complexType>
                    <xs:sequence>
                        <xs:element name="name" type="xs:string"/>
                        <xs:element name="difference">
                            <xs:simpleType>
                                <xs:restriction base="xs:decimal">
                                    <xs:minInclusive value="0"/>
                                </xs:restriction>
                            </xs:simpleType>
                        </xs:element>
                    </xs:sequence>
                </xs:complexType>
            </xs:element>
        </xs:sequence>
    </xs:complexType>
    
    <xs:element name="results">
        <xs:complexType>
            <xs:sequence>
                
                <xs:element name="better" type="avgJump">
                </xs:element>
                
                <xs:element name="worse" type="avgJump">
                </xs:element>
                
            </xs:sequence>
        </xs:complexType>
    </xs:element>
    
</xs:schema>

